{
  "id": "cameron-mold-ruiz",
  "slug": "cameron-mold-ruiz",
  "realName": "Cameron Ruiz",
  "nickname": "Mold",
  "historicalAliases": [],
  "nationality": "American",
  "city": "Truth or Consequences",
  "homeTown": {
    "city": "Truth or Consequences",
    "region": "New Mexico",
    "country": "United States"
  },
  "dateOfBirth": "2008-01-11",
  "ageAtCurrentStoryDate": 18,
  "game": "Counter-Strike",
  "role": "Entry",
  "currentTeam": "kairos-cs-main",
  "rosterLevel": "main",
  "status": "signed",
  "isCaptain": false,
  "firstAppearance": "episode-038",
  "joinedKairos": "2026-11-16",
  "contract": {
    "status": "signed",
    "signedDate": "2026-11-16",
    "startDate": "TBD",
    "endDate": "2027-12-31",
    "salary": "TBD"
  },
  "occupation": "Part-time mechanic",
  "personality": "Honest, straightforward, and team-first.",
  "playstyle": "Extremely aggressive Entry who accepts sacrificial roles.",
  "strengths": [
    "Aggressive entry play.",
    "Team-first mentality.",
    "Willingness to accept sacrificial roles.",
    "Honest and direct communication."
  ],
  "weaknesses": [],
  "inspirations": [],
  "objectives": [],
  "insecurities": [],
  "relationships": [
    {
      "subjectId": "caleb-atlas-mercer",
      "type": "initial-evaluation",
      "status": "confirmed"
    },
    {
      "subjectId": "adrian-elias-vale",
      "type": "evaluator",
      "status": "confirmed"
    },
    {
      "subjectId": "lukas-luk-novak",
      "type": "scout",
      "status": "confirmed"
    },
    {
      "subjectId": "ethan-trace-miller",
      "type": "evaluator",
      "status": "confirmed"
    },
    {
      "subjectId": "caleb-atlas-mercer",
      "type": "teammates",
      "status": "confirmed"
    },
    {
      "subjectId": "owen-glacier-fletcher",
      "type": "teammates",
      "status": "confirmed"
    },
    {
      "subjectId": "emiliano-moteconhuesillo-navarro",
      "type": "teammates",
      "status": "confirmed"
    },
    {
      "subjectId": "vincente-flacogomez-galan",
      "type": "teammates",
      "status": "confirmed"
    }
  ],
  "careerHistory": [
    {
      "organizationId": "kairos-esports",
      "teamId": "kairos-cs-main",
      "status": "signed",
      "joinedKairos": "2026-11-16",
      "firstProfessionalTeam": "TBD"
    }
  ],
  "individualTimeline": [
    "Episode 38: Cameron and the nickname Mold first appear in the Kairos scouting process.",
    "Episode 41: Cameron completes an initial interview; no trial, invitation, travel, or contract occurs.",
    "Episode 59: Kairos issues Cameron an invitation package.",
    "Episode 68: The five-player Kairos Counter-Strike main roster is completed on 2026-11-16.",
    "Episode 68: Cameron accepts the Kairos offer and joins the main roster as Entry on 2026-11-16.",
    "Episode 69: The completed roster holds its first full-team training session.",
    "Episodes 71-72: The completed roster plays a private, non-official practice series against Team Liquid; the event is excluded from official statistics and achievements."
  ],
  "statistics": {},
  "achievements": [],
  "trivia": [
    "His hometown, Truth or Consequences, New Mexico, is a real town that renamed itself in 1950 after a radio game show."
  ],
  "currentState": [
    "Signed to Kairos Counter-Strike on 2026-11-16.",
    "Active Entry on the complete main roster.",
    "Contract duration, salary, buyout, bonuses, and other terms are TBD."
  ],
  "nicknameFirstAppearance": "episode-038",
  "confirmedFacts": [
    "He is from Truth or Consequences, New Mexico.",
    "He is the signed Entry and works as a part-time mechanic.",
    "He is extremely aggressive, team-first, accepts sacrificial roles, and is honest and straightforward.",
    "His first appearance and the first appearance of the nickname Mold are in Episode 38.",
    "An initial evaluation relationship with Caleb Mercer is confirmed.",
    "He completes an initial interview in Episode 41.",
    "The Episode 41 interview is not a trial, invitation, travel event, or contract.",
    "His canonical role is Entry.",
    "He is 18 years old on 2026-11-24.",
    "His date of birth is 2008-01-11.",
    "Cameron accepts the Kairos offer and signs on 2026-11-16.",
    "He is the signed Entry of the complete Kairos Counter-Strike main roster.",
    "Confirmed nationalities: American."
  ],
  "unconfirmedDetails": [
    "Previous teams and tournament history are TBD.",
    "Contract duration, salary, buyout, bonuses, agent, and other financial terms are TBD."
  ],
  "canonNotes": [
    "Do not expand Cameron's biography beyond approved facts.",
    "The previous age-19 claim is retconned; current canon uses the confirmed birth date and age in this record.",
    "The Episode 68 signing replaces his earlier unsigned-prospect state without changing his identity, role, birth date, or prior chronology.",
    "Author confirmation, 2026-10-30: nationality follows the established home-country background, retaining explicitly confirmed dual nationality. Training in Los Angeles does not overwrite nationality."
  ],
  "nationalities": [
    "American"
  ]
}
