{
  "id": "nathan-0bit-hall",
  "slug": "nathan-0bit-hall",
  "realName": "Nathan Hall",
  "nickname": "0bit",
  "historicalAliases": [],
  "nationality": "American",
  "city": "Albuquerque",
  "homeTown": {
    "city": "Albuquerque",
    "region": "New Mexico",
    "country": "United States"
  },
  "dateOfBirth": "2010-03-18",
  "ageAtCurrentStoryDate": 16,
  "game": "League of Legends",
  "role": "Mid",
  "currentTeam": "kairos-lol-academy-white",
  "rosterLevel": "academy-white",
  "status": "active-training-pre-debut",
  "isCaptain": null,
  "firstAppearance": "TBD",
  "joinedKairos": "TBD",
  "contract": {
    "status": "TBD",
    "signedDate": "TBD",
    "startDate": "TBD",
    "endDate": "TBD",
    "salary": "TBD"
  },
  "personality": "TBD",
  "playstyle": "TBD",
  "strengths": [],
  "weaknesses": [],
  "inspirations": [],
  "objectives": [],
  "insecurities": [],
  "relationships": [],
  "careerHistory": [
    {
      "organizationId": "kairos-esports",
      "teamId": "kairos-lol-academy-white",
      "status": "active",
      "joinedKairos": "TBD",
      "firstProfessionalTeam": "TBD"
    }
  ],
  "individualTimeline": [],
  "statistics": {},
  "achievements": [],
  "trivia": [],
  "confirmedFacts": [
    "Nathan Hall \"0bit\" is active on Kairos Academy White.",
    "The player is training in Los Angeles.",
    "The player has not made an official competitive debut with Kairos.",
    "The player's role is Mid.",
    "The player is age 16 at the current story date of 2026-11-24.",
    "The player's date of birth is 2010-03-18.",
    "The player's confirmed city is Albuquerque, New Mexico.",
    "Confirmed nationalities: American."
  ],
  "unconfirmedDetails": [
    "First appearance is TBD.",
    "The exact date the player joined Kairos is TBD.",
    "Contract status, dates, and salary are TBD.",
    "Playstyle, strengths, weaknesses, inspirations, objectives, and insecurities are TBD.",
    "Statistics, achievements, and trivia are TBD.",
    "Personality is TBD.",
    "Captain status is TBD.",
    "Whether Kairos is the player's first professional team is TBD."
  ],
  "canonNotes": [
    "Do not infer nationality from city.",
    "No result, contract, salary, ranking, or statistic is confirmed unless explicitly recorded.",
    "The date of birth and age are confirmed canon and use 2026-11-24 as the age-reference date."
  ]
}
