{
  "id": "lucas-grit-foster",
  "slug": "lucas-grit-foster",
  "realName": "Lucas Foster",
  "nickname": "Grit",
  "historicalAliases": [],
  "nationality": "TBD",
  "city": "TBD",
  "dateOfBirth": "2008-11-05",
  "ageAtCurrentStoryDate": 18,
  "game": "League of Legends",
  "role": "Support",
  "currentTeam": "kairos-lol-academy-blue",
  "rosterLevel": "academy-blue",
  "status": "active-training-pre-debut",
  "isCaptain": null,
  "firstAppearance": "TBD",
  "joinedKairos": "TBD",
  "contract": {
    "status": "TBD",
    "signedDate": "TBD",
    "startDate": "TBD",
    "endDate": "TBD",
    "salary": "TBD"
  },
  "personality": "TBD",
  "playstyle": "TBD",
  "strengths": [],
  "weaknesses": [],
  "inspirations": [],
  "objectives": [],
  "insecurities": [],
  "relationships": [],
  "careerHistory": [
    {
      "organizationId": "kairos-esports",
      "teamId": "kairos-lol-academy-blue",
      "status": "active",
      "joinedKairos": "TBD",
      "firstProfessionalTeam": "TBD"
    }
  ],
  "individualTimeline": [],
  "statistics": {},
  "achievements": [],
  "trivia": [],
  "confirmedFacts": [
    "Lucas Foster \"Grit\" is active on Kairos Academy Blue.",
    "The player is training in Los Angeles.",
    "The player has not made an official competitive debut with Kairos.",
    "The player's role is Support.",
    "The player is age 18 at the current story date of 2026-11-24.",
    "The player's date of birth is 2008-11-05."
  ],
  "unconfirmedDetails": [
    "Nationality is TBD.",
    "First appearance is TBD.",
    "The exact date the player joined Kairos is TBD.",
    "Contract status, dates, and salary are TBD.",
    "Playstyle, strengths, weaknesses, inspirations, objectives, and insecurities are TBD.",
    "Statistics, achievements, and trivia are TBD.",
    "Personality is TBD.",
    "City is TBD.",
    "Captain status is TBD.",
    "Whether Kairos is the player's first professional team is TBD."
  ],
  "canonNotes": [
    "Do not infer nationality from city.",
    "No result, contract, salary, ranking, or statistic is confirmed unless explicitly recorded.",
    "The date of birth and age are confirmed canon and use 2026-11-24 as the age-reference date."
  ]
}
