{
  "id": "noah-rkn-bennett",
  "slug": "noah-rkn-bennett",
  "realName": "Noah Bennett",
  "nickname": "rkN",
  "historicalAliases": [
    {
      "nickname": "Rook",
      "status": "retconned",
      "sourceEpisode": "episode-002",
      "notes": "Historical source nickname replaced by rkN in current canon."
    }
  ],
  "nationality": "American",
  "city": "Seattle",
  "dateOfBirth": "2009-02-14",
  "ageAtCurrentStoryDate": 17,
  "game": "League of Legends",
  "role": "Top",
  "currentTeam": "kairos-lol-main",
  "rosterLevel": "main",
  "status": "active-training-pre-debut",
  "isCaptain": false,
  "firstAppearance": "episode-002",
  "joinedKairos": "TBD",
  "contract": {
    "status": "TBD",
    "signedDate": "TBD",
    "startDate": "TBD",
    "endDate": "2027-12-31",
    "salary": "TBD"
  },
  "personality": "TBD",
  "playstyle": "TBD",
  "strengths": [],
  "weaknesses": [],
  "inspirations": [],
  "objectives": [],
  "insecurities": [],
  "relationships": [
    {
      "subjectId": "darshan-kairos-top-mentor",
      "type": "role-mentor",
      "status": "confirmed"
    }
  ],
  "careerHistory": [
    {
      "organizationId": "kairos-esports",
      "teamId": "kairos-lol-main",
      "status": "active",
      "joinedKairos": "TBD",
      "firstProfessionalTeam": true
    }
  ],
  "individualTimeline": [
    "Episode 2: Noah first appears during Kairos's initial League recruitment."
  ],
  "statistics": {},
  "achievements": [],
  "trivia": [],
  "confirmedFacts": [
    "Noah Bennett \"rkN\" is active on Kairos League of Legends Main Team.",
    "The player is training in Los Angeles.",
    "The player has not made an official competitive debut with Kairos.",
    "The player's confirmed city is Seattle.",
    "Kairos is the player's first professional team.",
    "The player's first confirmed appearance is episode-002.",
    "The player's role is Top.",
    "The player is age 17 at the current story date of 2026-11-24.",
    "The player's date of birth is 2009-02-14.",
    "Confirmed nationalities: American."
  ],
  "unconfirmedDetails": [
    "The exact date the player joined Kairos is TBD.",
    "Contract status, dates, and salary are TBD.",
    "Playstyle, strengths, weaknesses, inspirations, objectives, and insecurities are TBD.",
    "Statistics, achievements, and trivia are TBD.",
    "Personality is TBD."
  ],
  "canonNotes": [
    "No result, contract, salary, ranking, or statistic is confirmed unless explicitly recorded.",
    "Do not invent previous professional teams.",
    "Historical aliases are archival only; current records and wiki pages must use the current nickname.",
    "The date of birth and age are confirmed canon and use 2026-11-24 as the age-reference date.",
    "Author confirmation, 2026-10-30: nationality follows the established home-country background, retaining explicitly confirmed dual nationality. Training in Los Angeles does not overwrite nationality."
  ],
  "nationalities": [
    "American"
  ]
}
